URL,Keywords
https://live-indiana-state-university.pantheonsite.io/academics/academic-program-finder/human-resource-development-higher-education-and-industry-bs,"development, human, resource, state, indiana, university, education, program, students, business, higher, programs, management, training, major, credit, overview, online, costs, campus, student, diversity, psychology, class, include, toggle, academic, administration, faculty, apply, ’, degree, information, hrd, areas, society, internship, learn, safety, united, graduates, skip, main, calendar, belonging, top, meet, flexible, designed, adult, learners, contact, us, systems, performance, curriculum, allow, association, shrm, classroom"
https://live-indiana-state-university.pantheonsite.io/academics/academic-program-finder/information-technology-bs,"technology, information, state, indiana, university, ’, faculty, program, science, engineering, development, credit, overview, academic, costs, electronics, major, degree, toggle, campus, diversity, earn, management, learn, company, skip, main, majors, programs, online, calendar, students, student, services, administration, belonging, vision, apply, top, toward, network, contact, us, department, skills, professionals, automation, data, gain, internships, co-ops, offers, systems, networking, cybersecurity, processing, completion, united, states, guidelines"
https://live-indiana-state-university.pantheonsite.io/academics/academic-program-finder/insurance-and-risk-management-bs,"insurance, risk, management, state, indiana, business, university, college, ’, program, irm, programs, scott, majors, financial, major, degree, overview, academic, students, costs, accounting, course, credit, toggle, campus, administration, diversity, faculty, top, analysis, skills, finance, one, learn, park, skip, main, online, calendar, student, belonging, give, apply, planning, contact, us, department, information, growing, demand, graduates, property, liability, internships, firms, compete, national, class, networks"
https://live-indiana-state-university.pantheonsite.io/academics/academic-program-finder/intelligence-analysis-bs,"intelligence, analysis, state, indiana, university, learn, criminal, program, security, ’, major, operations, overview, academic, costs, faculty, information, military, criminology, hands-on, skills, data, course, topics, include, arrow_forward, view, degree, main, toggle, campus, diversity, help, thinking, analyst, government, risk, participate, realistic, assessments, lab, cyber/intel, tools, technology, classes, hours, threats, counterintelligence, know, sycamore, skip, majors, programs, online, calendar, students, student, administration, belonging, apply"
https://live-indiana-state-university.pantheonsite.io/academics/academic-program-finder/interior-architecture-design-bfa,"design, interior, state, indiana, architecture, program, university, spaces, bfa, students, overview, costs, residential, learn, studio, indianapolis, credit, degree, toggle, academic, campus, diversity, faculty, apply, help, top, creative, commercial, us, ’, innovation, skills, hands-on, designers, complete, united, states, art, major, skip, main, majors, programs, online, calendar, student, administration, belonging, current, alumni, library, prepare, designer, institutional, product, contact, department, built, environment, information"
https://live-indiana-state-university.pantheonsite.io/academics/academic-program-finder/kinesiology-bs,"kinesiology, state, indiana, program, university, exercise, physiology, degree, students, health, ’, learn, faculty, college, overview, academic, costs, training, physical, major, biomechanics, credit, toggle, campus, recreation, diversity, allied, professions, sport, science, skip, main, majors, programs, online, calendar, student, administration, belonging, apply, help, top, prepares, careers, strength, education, within, contact, us, department, information, therapy, movement, laboratory, practical, hands-on, internship, area, focus, 's"
https://live-indiana-state-university.pantheonsite.io/academics/academic-program-finder/language-studies-ba,"language, state, indiana, university, languages, credit, cultural, program, foreign, linguistics, abroad, degree, learn, education, overview, students, costs, campus, ’, toggle, majors, programs, academic, diversity, faculty, department, major, areas, linguistic, center, united, states, office, skip, main, online, calendar, student, administration, belonging, alumni, apply, top, expand, cultures, preparing, contact, us, literatures, information, variety, fields, one, include, spanish, tutoring, instructors, toward, additional, advanced"
https://live-indiana-state-university.pantheonsite.io/academics/academic-program-finder/language-studies-teaching-ba,"language, state, indiana, university, students, foreign, languages, spanish, program, english, ’, skills, learn, education, degree, cultural, credit, overview, costs, campus, diversity, linguistics, world, major, high, advanced, classes, school, view, toggle, academic, student, faculty, second, department, literatures, teach, center, may, addition, arrow_forward, united, states, hall, skip, main, majors, programs, online, calendar, administration, belonging, apply, help, find, top, prepare, contact, us, information"
https://live-indiana-state-university.pantheonsite.io/academics/academic-program-finder/legal-studies-bs,"legal, state, indiana, program, law, university, students, political, science, academic, campus, faculty, school, college, overview, costs, student, careers, department, ’, offers, court, learn, major, credit, toggle, programs, diversity, apply, system, analytical, communication, skills, prepare, american, may, project, many, skip, main, majors, online, calendar, clubs, administration, belonging, top, succeed, pursue, contact, us, information, systems, curriculum, pre-law, bar, 's, oral, lsat, view"
https://live-indiana-state-university.pantheonsite.io/academics/academic-program-finder/management-bs,"management, business, state, indiana, university, college, students, program, human, resource, majors, teams, organizational, information, learn, overview, academic, costs, administration, ethics, scott, major, credit, toggle, programs, campus, student, diversity, faculty, skills, strategic, projects, may, skip, main, online, calendar, belonging, alumni, give, apply, top, manage, design, development, sectors, contact, us, systems, ’, degree, practice, graduates, lead, mentorship, professors, professionals, corporate, class, internships"
https://live-indiana-state-university.pantheonsite.io/academics/academic-program-finder/manufacturing-engineering-technology-bs,"technology, manufacturing, engineering, state, indiana, university, program, college, major, credit, learn, overview, academic, students, costs, diversity, ’, united, states, control, toggle, campus, faculty, earn, gain, management, professions, coursework, skip, main, majors, programs, online, calendar, freshman, student, administration, belonging, alumni, apply, top, toward, degree, information, professionals, processes, production, graduation, careers, systems, quality, practical, experiences, completion, participate, internship, employed, graduates, 's, equipment"
https://live-indiana-state-university.pantheonsite.io/academics/academic-program-finder/marketing-bs,"marketing, business, indiana, state, sales, management, university, learn, degree, program, ’, college, negotiations, strategies, credit, overview, programs, academic, students, costs, administration, faculty, skills, scott, center, toggle, campus, student, diversity, apply, force, provide, professionals, development, service, product, training, view, map, world, major, skip, main, majors, online, calendar, belonging, help, top, build, contact, us, information, advertising, market, provides, theories, theory, practice, internships"
https://live-indiana-state-university.pantheonsite.io/academics/academic-program-finder/mathematics-babs,"mathematics, state, indiana, university, statistics, faculty, major, academic, program, learn, degree, science, ’, college, overview, students, costs, services, algebra, mathematical, credit, ba/bs, toggle, majors, programs, campus, diversity, department, fields, analysis, sciences, skip, main, online, calendar, student, administration, belonging, alumni, apply, top, explore, logic, areas, math, contact, us, information, earn, skills, thinking, analytical, finance, calculus, dynamical, systems, linear, abstract, engineering, excellent"
https://live-indiana-state-university.pantheonsite.io/academics/academic-program-finder/mathematics-teaching-bs,"mathematics, indiana, state, university, students, school, program, education, math, middle, high, college, learn, degree, student, ’, teach, overview, academic, costs, algebra, geometry, calculus, subjects, major, take, credit, toggle, campus, diversity, faculty, library, science, classes, skip, main, majors, programs, online, calendar, administration, belonging, parents, apply, help, top, contact, us, department, information, numbers, statistics, experiences, local, instructors, conferences, explore, resource, bayh, per"
https://live-indiana-state-university.pantheonsite.io/academics/academic-program-finder/mechanical-engineering-technology-bs,"engineering, technology, mechanical, state, indiana, university, manufacturing, program, design, management, college, credit, learn, engineers, overview, academic, students, costs, faculty, gain, production, practical, major, toggle, campus, diversity, systems, ’, graduates, positions, project, analysis, computer-aided, united, states, coursework, manager, skip, main, majors, programs, online, calendar, freshman, student, administration, belonging, apply, find, top, skills, contact, us, department, information, earn, principles, quality, assurance, technologies"
https://live-indiana-state-university.pantheonsite.io/academics/academic-program-finder/middle-school-mathematics-teaching-bs,"mathematics, school, middle, indiana, state, students, algebra, university, program, teach, education, ’, math, classes, take, geometry, calculus, overview, academic, costs, student, faculty, statistics, major, credit, degree, toggle, programs, campus, diversity, help, library, advanced, science, department, numbers, learn, logic, grades, five, eight, college, view, abroad, skip, main, majors, online, calendar, administration, belonging, parents, apply, top, high, contact, us, information, instruction, elementary"
https://live-indiana-state-university.pantheonsite.io/academics/academic-program-finder/multidisciplinary-studies-ba-bs,"multidisciplinary, students, program, state, arts, indiana, university, college, major, business, academic, degree, view, programs, administration, faculty, map, student, pursue, liberal, social, learn, arrow_forward, overview, costs, ’, goals, across, sciences, option, individualized, gender, justice, global, credit, toggle, campus, diversity, designed, design, health, disciplines, interests, advisor, concentrations, minor, track, sociology, visual, human, skip, main, online, calendar, clubs, services, belonging, current, apply, find"
https://live-indiana-state-university.pantheonsite.io/academics/academic-program-finder/music-composition-bm,"music, state, indiana, composition, university, degree, program, performance, ’, ensembles, perform, bm, majors, faculty, learn, college, overview, academic, students, costs, campus, student, theory, school, musical, major, credit, toggle, diversity, provide, accreditation, skip, main, programs, online, calendar, admitted, administration, belonging, apply, top, transform, musicianship, enhance, contact, us, information, original, compositions, prepare, careers, composing, arranging, creative, professions, take, participate, private, lessons, attend"
https://live-indiana-state-university.pantheonsite.io/academics/academic-program-finder/music-education-bme,"music, education, indiana, state, ’, university, school, program, ensembles, majors, learn, degree, students, faculty, classes, student, bme, teach, teachers, perform, orchestra, grade, overview, academic, costs, campus, general, conducting, take, piano, performance, major, jazz, elementary, middle, high, levels, credit, toggle, diversity, choral, theory, musicians, two, –, choral/general, instrumental/general, focus, private, addition, chorale, view, vocal, band, composition, accreditation, skip, main, programs, online"
https://live-indiana-state-university.pantheonsite.io/academics/academic-program-finder/music-liberal-arts-ba,"music, state, arts, indiana, liberal, university, education, program, ’, ensembles, administration, school, major, faculty, perform, degree, overview, majors, academic, students, costs, campus, business, learn, credit, toggle, programs, diversity, apply, english, 's, musical, abroad, accreditation, skip, main, online, calendar, admitted, student, belonging, top, contact, us, information, theoretical, cultural, communication, well-rounded, preparation, classes, participate, performance, private, lessons, attend, concerts, piano, addition, admission"
https://live-indiana-state-university.pantheonsite.io/academics/academic-program-finder/music-performance-bm,"music, performance, ensembles, state, indiana, university, school, perform, skills, piano, students, ’, theory, talents, brass, percussion, degree, program, string, jazz, orchestra, learn, symphony, literature, view, pedagogy, bm, faculty, musical, major, focuses, highlight, musicianship, typically, members, ensemble, arrow_forward, majors, wind, chorale, woodwind, overview, costs, campus, student, private, education, credit, toggle, academic, diversity, practice, techniques, take, lessons, strengthen, voice, recitals, addition, orchestras"
https://live-indiana-state-university.pantheonsite.io/academics/academic-program-finder/music-merchandising-or-business-administration-bs,"music, business, state, indiana, merchandising, administration, university, degree, faculty, marketing, ’, program, school, ensembles, majors, students, learn, management, addition, concentrations, overview, programs, costs, campus, student, prepare, major, perform, credit, toggle, academic, diversity, side, performance, musical, –, professionals, product, view, internship, college, united, states, accreditation, skip, main, online, calendar, admitted, belonging, apply, help, find, top, fields, principles, finance, contact, us, information"
https://live-indiana-state-university.pantheonsite.io/academics/academic-program-finder/nursing-bsn,"nursing, state, indiana, university, program, students, ’, nurses, student, care, bsn, registered, admission, major, apply, baccalaureate, learn, clinical, overview, admitted, costs, campus, faculty, science, first, credit, healthcare, toggle, academic, diversity, traditional, degree, preparation, great, school, nclex-rn, eligible, practice, gpa, settings, skip, main, majors, programs, online, calendar, administration, belonging, mission, top, offers, rn, licensure, four-year, excellent, nurse, roles, contact, information, professionals"
https://live-indiana-state-university.pantheonsite.io/academics/academic-program-finder/nutrition-and-wellness-bs,"nutrition, state, indiana, wellness, health, university, degree, program, ’, major, college, overview, academic, students, costs, faculty, learn, credit, public, toggle, programs, campus, diversity, united, states, excellent, nutritional, skip, main, majors, online, calendar, student, administration, belonging, apply, help, top, contact, us, information, earn, nutritionists, participate, development, community, guidelines, settings, maximize, menu, navigation, freshman, admitted, orientation, scholarships, bursar, financial, clubs, dining, recreation"
https://live-indiana-state-university.pantheonsite.io/academics/academic-program-finder/occupational-safety-management-accelerated-ms,"safety, management, program, state, occupational, indiana, university, ’, master, accelerated, science, academic, students, ms, overview, costs, campus, student, apply, toggle, programs, scholarships, administration, diversity, faculty, contact, information, may, enables, engineering, graduates, accreditation, major, skip, main, online, calendar, belonging, current, top, earning, degree, 4+1, us, offered, terre, haute, eligible, include, pathway, faster, participate, year, one, learn, opportunity, professionals, assp, manufacturing, federal"
https://live-indiana-state-university.pantheonsite.io/academics/academic-program-finder/online-computer-science-ms,"science, university, state, indiana, online, students, program, apply, data, application, ms, master, skills, areas, important, overview, academic, costs, student, degree, years, u.s., isu, toggle, programs, calendar, campus, diversity, faculty, information, ’, select, two, foundation, algorithms, provides, software, positions, bioinformatics, graduates, deadlines, attended, fee, semester, 1, skip, main, admitted, services, administration, belonging, current, myisu, top, transcripts, offers, education, interests, members, complete"
https://live-indiana-state-university.pantheonsite.io/academics/academic-program-finder/online-leadership-and-professional-development-bs,"minor, program, online, development, state, indiana, track, university, students, certificate, costs, degree, open, core, overview, administration, diversity, u.s., ’, individualized, education, includes, offered, entrepreneurship, credit, toggle, academic, campus, student, faculty, contact, flexible, designed, earned, fast-paced, prior, isu, advisor-approved, tailor, 8-week, semesters, requirements, skills, tracks, educational, management, human, higher, completion, 's, major, skip, main, majors, programs, calendar, belonging, current, apply, top"
https://live-indiana-state-university.pantheonsite.io/academics/academic-program-finder/online-nursing-accelerated-second-degree-bsn,"nursing, indiana, state, university, program, degree, online, ’, accelerated, second, clinical, bsn, students, nurses, learn, major, student, registered, care, healthcare, admission, overview, costs, campus, faculty, apply, school, skills, settings, baccalaureate, toggle, academic, diversity, benefit, graduates, patient, professor, cannon, skip, main, programs, calendar, admitted, administration, belonging, top, science, become, nurse, rn, contact, information, must, completed, designed, higher, hands-on, on-campus, experiences, education"
https://live-indiana-state-university.pantheonsite.io/academics/academic-program-finder/online-nursing-lpnlvn-bsn,"nursing, state, indiana, online, program, lpn/lvn, bsn, university, ’, students, track, nurses, learn, care, healthcare, overview, costs, campus, student, faculty, registered, settings, baccalaureate, toggle, academic, diversity, earn, science, degree, requirements, nclex-rn, graduates, patient, professor, cannon, major, skip, main, programs, calendar, administration, belonging, current, apply, top, credit, nurse, contact, school, information, availability, eligible, personnel, country, view, enables, practical/vocational, via, visits, benefit"
https://live-indiana-state-university.pantheonsite.io/academics/academic-program-finder/online-occupational-safety-management-ms,
https://live-indiana-state-university.pantheonsite.io/academics/academic-program-finder/online-organizational-leadership-and-supervision-bs,"program, online, state, indiana, organizational, supervision, university, students, degree, ’, credit, overview, costs, u.s., ols, college, core, major, toggle, academic, campus, student, diversity, faculty, apply, information, military, offers, designed, earned, coursework, skills, 's, training, requirements, skip, main, majors, programs, calendar, administration, belonging, help, top, advance, degree-completion, contact, us, department, education, open, canada, flexible, individualized, approach, completing, advancing, benefit, individuals, approximately"
https://live-indiana-state-university.pantheonsite.io/academics/academic-program-finder/online-school-administration-and-supervision-med,"school, administration, indiana, supervision, state, program, online, med, university, must, building, license, students, licensure, application, administrator, two, overview, programs, costs, master, education, level, years, includes, 's, internship, toggle, academic, calendar, campus, student, diversity, apply, coursework, degree, part, requirements, hold, pass, semester, curriculum, principal, isu, fee, master's, skip, main, belonging, top, transcripts, professionals, public, private, information, ’, fulfills, established, standards, board"
https://live-indiana-state-university.pantheonsite.io/academics/academic-program-finder/operations-and-supply-chain-management-bs,"management, operations, supply, chain, state, indiana, business, university, students, learn, program, faculty, analytics, overview, costs, major, systems, successful, credit, toggle, programs, academic, campus, services, diversity, find, effective, information, manufacturing, logistics, class, lot, skip, main, majors, online, calendar, financial, student, administration, belonging, give, apply, help, top, real, problems, technology, contact, us, marketing, areas, real-world, practical, modern, operating, global, coursework, earned, risk"
https://live-indiana-state-university.pantheonsite.io/academics/academic-program-finder/packaging-engineering-technology-bs,"technology, engineering, packaging, state, indiana, university, program, major, college, technical, design, united, learn, credit, degree, overview, academic, students, costs, campus, diversity, manufacturing, graduates, states, toggle, programs, faculty, gain, management, earn, ’, offers, experiences, participate, national, 's, professionals, include, skip, main, majors, online, calendar, freshman, scholarships, financial, student, administration, belonging, apply, top, skills, careers, quality, contact, us, department, information, close, excellent"
https://live-indiana-state-university.pantheonsite.io/academics/academic-program-finder/philosophy-ba,"philosophy, state, indiana, university, program, major, multidisciplinary, law, business, ethics, degree, overview, costs, faculty, questions, education, credit, toggle, programs, academic, students, campus, diversity, find, important, ethical, logical, ’, cultural, study-abroad, internship, abroad, skip, main, majors, online, calendar, student, administration, belonging, give, apply, help, top, reasoning, careers, medicine, writing, contact, us, department, information, skills, view, world, people, learn, 's, professors, assist"
https://live-indiana-state-university.pantheonsite.io/academics/academic-program-finder/physical-education-all-grades-bs,"education, physical, indiana, state, all-grade, school, students, university, student, program, degree, programs, fitness, sports, recreation, elementary, ’, major, overview, costs, campus, high, middle, credit, toggle, academic, diversity, faculty, apply, coach, become, center, skip, main, majors, online, calendar, administration, belonging, top, grades, combine, contact, us, kinesiology, sport, information, skills, educate, healthy, active, theoretical, areas, social, activity, local, grade, levels, participate, intramural"
https://live-indiana-state-university.pantheonsite.io/academics/academic-program-finder/physics-bs-ba,"physics, state, indiana, degree, university, faculty, program, academic, students, engineering, major, map, ’, view, college, science, scientific, learn, may, overview, costs, chemistry, credit, toggle, majors, programs, campus, student, diversity, apply, theoretical, industrial, award, 's, designed, pursue, chemical, physicists, government, united, states, skip, main, online, calendar, administration, belonging, top, careers, computing, school, contact, us, department, information, enjoy, atomic, new, technologies, unique"
https://live-indiana-state-university.pantheonsite.io/academics/academic-program-finder/political-science-ba,"political, state, indiana, science, university, politics, ’, public, law, major, may, government, campus, program, american, credit, overview, academic, costs, faculty, policy, communication, local, community, toggle, majors, programs, students, student, administration, diversity, apply, world, advocacy, department, service, include, learn, business, huntsinger, skip, main, online, calendar, clubs, recreation, belonging, engagement, top, global, affairs, contact, us, information, close, school, excellent, legal, systems, justice"
https://live-indiana-state-university.pantheonsite.io/academics/academic-program-finder/pre-athletic-training,"state, indiana, training, program, university, athletic, pre-athletic, ’, college, overview, academic, costs, pre-professional, credit, toggle, programs, students, campus, diversity, faculty, help, contact, information, major, degree, learn, skip, main, online, calendar, student, administration, belonging, apply, top, preprofessional, us, department, john.pommier, indstate.edu, step, advisor, united, states, guidelines, trainers, maximize, therapy, menu, navigation, majors, freshman, admitted, orientation, scholarships, bursar, financial, clubs, dining, recreation"
